,author,author_flair_text,post_text,likes,subreddit_id,created_utc,score,post_url,subreddit,parent_id
0,coinmarketcap,,Meta Gets Questioned Over Digital Assets Plans by US Rep Maxine Waters,,t5_3o54z,1705991022.0,1,https://coinmarketcap.com/academy/article/meta-gets-questioned-over-digital-assets-plans-by-us-rep-maxine-waters,CoinMarketCap,n/a_submissions
1,Excellent-Product992,,Roommate cuts contact after i don’t reply to her text fast enough,,t5_446kys,1705991022.0,1,https://www.reddit.com/r/AITAH/comments/19dhylk/roommate_cuts_contact_after_i_dont_reply_to_her/,AITAH,n/a_submissions
2,NotJustMyDisorders,,Crock pot infusion- 150° how long?,,t5_2t3z8,1705991022.0,1,https://www.reddit.com/r/treedibles/comments/19dhylj/crock_pot_infusion_150_how_long/,treedibles,n/a_submissions
3,ShipNew4209,,old ps4 is this done for??,,t5_2tjv1,1705991022.0,1,https://www.reddit.com/gallery/19dhyli,consolerepair,n/a_submissions
4,Whey-Men,,"A Hardin County police officer has died weeks after he was arrested and charged with rape and sodomy of a child. David Love, 69, was arrested on Jan. 4 after Kentucky State Police began investigating him for reportedly having a sexual relationship with a 14-year-old.",,t5_2sbiw,1705991022.0,1,https://www.wlky.com/article/retired-hardin-county-police-officer-dies-rape-sodomy/46413065,prisons,n/a_submissions
5,coinmarketcap,,Hackers Use Pirated Software on MacOS To Infect Bitcoin Wallets With Malware,,t5_3o54z,1705991021.0,1,https://coinmarketcap.com/academy/article/hackers-use-pirated-software-on-macos-to-infect-bitcoin-wallets-with-malware,CoinMarketCap,n/a_submissions
6,coinmarketcap,,"Bitcoin Drops Below $40,000 As Investors Cash Out of GBTC",,t5_3o54z,1705991021.0,1,https://coinmarketcap.com/academy/article/bitcoin-drops-below-dollar40000-as-investors-cash-out-of-gbtc,CoinMarketCap,n/a_submissions
7,Various_Reason_1540,,has anyone here seen more of Ellie? please dm me,,t5_an2unz,1705991021.0,1,https://i.redd.it/r3cq1mw6v4ec1.jpeg,jerkbuds_nolim019,n/a_submissions
8,Zealousideal-Bit-437,,Did anyone try this ?,,t5_52t40p,1705991020.0,1,https://i.redd.it/o8eijip6v4ec1.jpeg,DesiFragranceAddicts,n/a_submissions
9,Impossible-Bar-9335,,Will I ever wanna top my bf again?,,t5_2vgfw,1705991019.0,1,https://www.reddit.com/r/askgaybros/comments/19dhyks/will_i_ever_wanna_top_my_bf_again/,askgaybros,n/a_submissions
10,Whole_Caramel9961,,Send confessions and dark desires NL 058afde65fa681fc561eb14c3543075c0a96015371a13ce8cc07cbfe7c69f07f28,,t5_an2unz,1705991019.0,1,https://www.reddit.com/r/jerkbuds_nolim019/comments/19dhykn/send_confessions_and_dark_desires_nl/,jerkbuds_nolim019,n/a_submissions
11,AntiFacistBossBitch,They shall not pass,I don’t think the world can forgive you if you elevate this utter scum to potus yet again,,t5_in7k7,1705991019.0,1,https://i.redd.it/bhcpy8n6v4ec1.jpeg,Qult_Headquarters,n/a_submissions
12,t_nutt,,What are science fiction like things existing today that not many people are aware of?,,t5_2qh1i,1705991019.0,1,https://www.reddit.com/r/AskReddit/comments/19dhykl/what_are_science_fiction_like_things_existing/,AskReddit,n/a_submissions
13,Pleasant_Tadpole2960,,Which end is the canon ending in Help Wanted 2 ?,,t5_331ct,1705991019.0,1,https://i.redd.it/53gejkm6v4ec1.jpeg,fivenightsatfreddys,n/a_submissions
14,ANDYWAFFLEZ,,⚠️ (WARNING) 🚨BITCOIN CRASH 🚨 DXY PUMPS !!,,t5_olwjp,1705991019.0,1,https://youtu.be/9wVlPJRC41U?si=C787KhnHgYvYSNN3,CryptoTradingFloor,n/a_submissions
15,klaus_bei_gesa,,Ich stelle mich vor,,t5_an3jno,1705991019.0,1,https://www.reddit.com/r/GESA2024E/comments/19dhykg/ich_stelle_mich_vor/,GESA2024E,n/a_submissions
16,tbeckdogg,,Stimulus-Hurry Before It's Gone-$10 Referrals,,t5_5jh0lt,1705991018.0,1,https://www.reddit.com/r/ReferralsHere/comments/19dhykb/stimulushurry_before_its_gone10_referrals/,ReferralsHere,n/a_submissions
17,novixus1108,,I finally reached my first $1000!!!,,t5_3fhq0,1705991018.0,1,https://i.redd.it/g8pi07k6v4ec1.jpeg,Mercari,n/a_submissions
18,reddit_lss_1,first flair,Comments and replies order for 23/1/2024 06:22:23,,t5_k24d4,1705991018.0,1,https://www.reddit.com/r/LssAutomation/comments/19dhyk4/comments_and_replies_order_for_2312024_062223/,LssAutomation,n/a_submissions
19,miss_questiona,,Some of my comment section keeps being turned off,,t5_2sy0y,1705991017.0,1,https://www.reddit.com/r/Pinterest/comments/19dhyk2/some_of_my_comment_section_keeps_being_turned_off/,Pinterest,n/a_submissions
20,stockings_for_life,New Poster,"Please, rate my vocabulary and grammar below.",,t5_2u8ap,1705991017.0,1,https://www.reddit.com/r/EnglishLearning/comments/19dhyjt/please_rate_my_vocabulary_and_grammar_below/,EnglishLearning,n/a_submissions
21,spongebobs_pineapple,,Daily Thread / January 23,,t5_4rlbp4,1705991017.0,1,https://www.reddit.com/r/DaniAustin/comments/19dhyjs/daily_thread_january_23/,DaniAustin,n/a_submissions
22,emona89,,홈택스 사업용 카드 등록하는 방법 자세히 알아보기,,t5_7j0ya6,1705991017.0,1,https://www.reddit.com/r/koreaedunews/comments/19dhyjq/홈택스_사업용_카드_등록하는_방법_자세히_알아보기/,koreaedunews,n/a_submissions
23,I-Stan-Alfred-J-Kwak,,Superman lets people die,,t5_32q13,1705991015.0,1,https://static1.cbrimages.com/wordpress/wp-content/uploads/2022/09/grounded.jpg?q=50&amp;fit=crop&amp;w=480&amp;dpr=1.5,outofcontextcomics,n/a_submissions
24,hpepper24,,Does LAPD polygraph? How do they test to figure out you have done drugs in the last 2 years?,,t5_2t9pd,1705991014.0,1,https://www.reddit.com/r/911dispatchers/comments/19dhyiz/does_lapd_polygraph_how_do_they_test_to_figure/,911dispatchers,n/a_submissions
25,marissa874,,Sad my brother and I looked so similar,,t5_2s36e,1705991013.0,1,https://www.reddit.com/r/GriefSupport/comments/19dhyis/sad_my_brother_and_i_looked_so_similar/,GriefSupport,n/a_submissions
26,Roodle-McDoodle,,Name for the 2-year-old stray ginger I adopted?,,t5_2xmrc,1705991013.0,1,https://www.reddit.com/r/namenerds/comments/19dhyiq/name_for_the_2yearold_stray_ginger_i_adopted/,namenerds,n/a_submissions
27,Tehfamine,,Is Tool &amp; Die Viable Today?,,t5_2qz70,1705991013.0,1,https://www.reddit.com/r/manufacturing/comments/19dhyin/is_tool_die_viable_today/,manufacturing,n/a_submissions
28,Jackypawz,,IM TRADING THIS MEGA CROCODILE FOR THE BEST ADOPT ME CASH OFFER. (USING ALT ACCS TO TRANSFER THE MONEY WOULD BE FASTER) NYP IF CAN.,,t5_2bdleh,1705991013.0,1,https://i.redd.it/cgovcv06v4ec1.jpeg,AdoptMeTrading,n/a_submissions
29,Akejdncjsjaj,,How many actions would it be to drive a piton in?,,t5_gkc60,1705991012.0,1,https://www.reddit.com/r/Pathfinder2e/comments/19dhyib/how_many_actions_would_it_be_to_drive_a_piton_in/,Pathfinder2e,n/a_submissions
30,Poutcheki,,Bitcoin cale ! Grayscale et FTX déstabilisent complètement le marché des cryptos,,t5_6erdte,1705991012.0,1,https://www.cointribune.com/bitcoin-cale-grayscale-et-ftx-destabilisent-completement-le-marche-des-cryptos/,CryptoSenegal,n/a_submissions
31,Thin_Reindeer_9647,,Weird Red Flags,,t5_313sv,1705991011.0,1,https://www.reddit.com/r/CallCenterWorkers/comments/19dhyi6/weird_red_flags/,CallCenterWorkers,n/a_submissions
32,thedevilknowsnoevil,,help me 39F,,t5_2rgjh,1705991011.0,1,https://i.redd.it/gygraul5v4ec1.jpeg,amiugly,n/a_submissions
33,Zestraks,Kotori Cardinal,Daily Kotori post #393,,t5_2nekh1,1705991011.0,1,https://i.redd.it/t798llp5v4ec1.jpeg,churchofkotori,n/a_submissions
34,DMGrognerd,,People laughing with their cats,,t5_5zvcfk,1705991010.0,1,https://www.reddit.com/gallery/19dhyhv,midjourney,n/a_submissions
35,DistributionFar1411,,First 6 hours of progress for my alt🔥🔥🔥,,t5_iuitf,1705991010.0,1,https://www.reddit.com/r/BeeSwarmSimulator/comments/19dhyhm/first_6_hours_of_progress_for_my_alt/,BeeSwarmSimulator,n/a_submissions
36,peakedtooearly,,More than 2m UK prepay meter users to be cut off from gas or electric this winter,,t5_2qhqb,1705991010.0,1,https://www.theguardian.com/money/2024/jan/23/uk-prepay-meter-users-cut-off-gas-electric-this-winter,unitedkingdom,n/a_submissions
37,ElectronicFudge5,,DNA Detectives: Solving decades-old mysteries with forensic genealogy,,t5_2amtn2,1705991009.0,1,https://www.live5news.com/2024/01/22/dna-detectives-solving-decades-old-mysteries-with-forensic-genealogy/?outputType=amp,GeneticGenealogyNews,n/a_submissions
38,Verukins,,What do people use for data tiering here?,,t5_2qnp7,1705991009.0,1,https://www.reddit.com/r/sysadmin/comments/19dhyha/what_do_people_use_for_data_tiering_here/,sysadmin,n/a_submissions
39,yawinsomeyachewgum,,Second win of the night,,t5_2qsev,1705991008.0,1,https://v.redd.it/82bt2cf5v4ec1,ufc,n/a_submissions
40,CuteSeaworthiness688,,"When an item's variation and picture/title don't match up, do you go with the variation or the picture?",,t5_28yu6q,1705991008.0,1,https://www.reddit.com/r/AmazonVine/comments/19dhyh3/when_an_items_variation_and_picturetitle_dont/,AmazonVine,n/a_submissions
41,nomnom1512,18F,HE'S SO FINEE I WANNA CRYYYYYY,,t5_2zhzn,1705991008.0,1,https://www.reddit.com/r/IndianTeenagers/comments/19dhygz/hes_so_finee_i_wanna_cryyyyyy/,IndianTeenagers,n/a_submissions
42,BackVegetable4147,,I need to get clean.,,t5_31378,1705991007.0,1,https://www.reddit.com/r/sobrietyandrecovery/comments/19dhygy/i_need_to_get_clean/,sobrietyandrecovery,n/a_submissions
43,ElectricCuckaloo,,I hate being bad at math and anything that requires logic,,t5_2qhs6,1705991007.0,1,https://www.reddit.com/r/autism/comments/19dhygx/i_hate_being_bad_at_math_and_anything_that/,autism,n/a_submissions
44,rClipsBot,,Present Them,,t5_2r9bv,1705991007.0,1,https://clips.twitch.tv/PrettyRoughRedpandaBatChest-M9n60UaIwliAv501,clips,n/a_submissions
45,Heromanv1,Cyberpunk Low-magi mage. Recovering from void travel arc.,"Vent post, to help with my tribulation healing.",,t5_5hjlp1,1705991007.0,1,https://www.reddit.com/gallery/19dhygv,wizardposting,n/a_submissions
46,liquidblueyes,,New thoughts on Blasters T,,t5_32oeb,1705991007.0,1,https://www.reddit.com/r/yokaiwatch/comments/19dhygt/new_thoughts_on_blasters_t/,yokaiwatch,n/a_submissions
47,Ecstatic_Metal_186,,Ya boy got a point,,t5_3ensl,1705991007.0,1,https://www.reddit.com/r/DJAkademiks/comments/19dhygp/ya_boy_got_a_point/,DJAkademiks,n/a_submissions
48,YvngPant,,Little something I'm working on,,t5_2rgym,1705991005.0,1,https://v.redd.it/dx7x1tl4v4ec1,HalfLife,n/a_submissions
49,squelchingtard,,Virgin Dating vs Chad Making Your Own Friends,,t5_3nl7k,1705991005.0,1,https://i.redd.it/r2nrdkm4u4ec1.png,virginvschad,n/a_submissions
50,InternationalSale752,Custom Flair,Does the MBP charge slower with other chargers?,,t5_2xhss,1705991005.0,1,https://www.reddit.com/r/macbookpro/comments/19dhygc/does_the_mbp_charge_slower_with_other_chargers/,macbookpro,n/a_submissions
51,XTYZMOP,,Maybe Maybe Maybe,,t5_38e1l,1705991005.0,1,https://v.redd.it/v891qq91v4ec1,maybemaybemaybe,n/a_submissions
52,lh7884,,"Canada needs to consider the costs of its current immigration strategy. Over the last decade, Canada has relied almost exclusively on immigration to grow the economy.",,t5_6jb8wg,1705991005.0,1,https://biv.com/article/2024/01/canada-needs-consider-costs-its-current-immigration-strategy,Canada_sub,n/a_submissions
53,Sankarahampton,,Fome do carai kkk,,t5_395lw,1705991005.0,1,https://www.reddit.com/r/desabafos/comments/19dhyg8/fome_do_carai_kkk/,desabafos,n/a_submissions
54,WillingSummer8070,,Whose ass are you picking? Can feed more of your fav. Disc rrrk2002 or Kik sthsactted,,t5_an2unz,1705991005.0,1,https://i.redd.it/is4a3a04v4ec1.jpeg,jerkbuds_nolim019,n/a_submissions
55,Kryptedbbkick,,Can someone explain?,,t5_2y8rx,1705991005.0,1,https://v.redd.it/h6g2h4i4v4ec1,samsunggalaxy,n/a_submissions
56,Rich-Guarantee-441,,Fiverr - Freelance Services Marketplace,,t5_wctxt,1705991004.0,1,https://i.redd.it/2qb9cm54v4ec1.png,PanelGore,n/a_submissions
57,Sudden-Wrongdoer2885,,Is there a way to remove wraps or liveries in FH3?,,t5_2ug54,1705991004.0,1,https://www.reddit.com/r/ForzaHorizon/comments/19dhyg1/is_there_a_way_to_remove_wraps_or_liveries_in_fh3/,ForzaHorizon,n/a_submissions
58,Zealousideal_Set_464,,It all makes sense now,,t5_2u49m,1705991004.0,1,https://i.redd.it/vaogmx25v4ec1.png,Markiplier,n/a_submissions
59,CollectionGlad6252,,Skutt Firebox 8x6 kiln supplier suggestions?,,t5_2re38,1705991004.0,1,https://www.reddit.com/r/Pottery/comments/19dhyfw/skutt_firebox_8x6_kiln_supplier_suggestions/,Pottery,n/a_submissions
60,ElectricalMiddle7738,,Mr G last talked to spidey thursday,,t5_7zpdxo,1705991004.0,1,https://v.redd.it/ksu14qs2v4ec1,turanspidey,n/a_submissions
61,Other-Bunch9533,,Entrance to a Run-down Mineshaft,,t5_2sg5b,1705991003.0,1,https://i.redd.it/bpeijb15v4ec1.jpeg,Terraria,n/a_submissions
62,Unfair999,,Need a fake alpha to feed me Valkyrae and Pokimane while I tease/bully you for being a fake alpha dm or 0583a38543818587bc77a13f517a05b56e3a628e6345fe17699c903af6598f366a,,t5_an2unz,1705991003.0,1,https://www.reddit.com/r/jerkbuds_nolim019/comments/19dhyfp/need_a_fake_alpha_to_feed_me_valkyrae_and/,jerkbuds_nolim019,n/a_submissions
63,Foreveraudio,,Red round spot on right butt cheek ?,,t5_2rg7m,1705991003.0,1,https://i.redd.it/ktcedxx4v4ec1.jpeg,skin,n/a_submissions
64,DYangchen,,A Week After Bone Grafting,,t5_38bow,1705991002.0,1,https://www.reddit.com/r/askdentists/comments/19dhyfl/a_week_after_bone_grafting/,askdentists,n/a_submissions
65,4gigiplease,,"TAKE ACTION: Write an email to the Miami Mayor to tell her to SHUT DOWN Miami Sea Aquarium, a polite one. She is on our side now.",,t5_31o5c,1705991002.0,1,/r/buysafebuygreen/comments/19dhk1g/take_action_write_an_email_to_the_miami_mayor_to/,Tarots,n/a_submissions
66,CubeDragon23,,“I thought he was with you”. Acrylic on canvas board.,,t5_2sgc2,1705991002.0,1,https://i.redd.it/ke1mfeweu4ec1.jpeg,AbstractArt,n/a_submissions
67,OkTransportation6461,,Menorrhagia whatever shit,,t5_2s14a,1705991002.0,1,https://www.reddit.com/r/Periods/comments/19dhyf8/menorrhagia_whatever_shit/,Periods,n/a_submissions
68,Invader_Skoodge69,,Portable playstation tv,,t5_7o5myc,1705991001.0,1,https://www.reddit.com/gallery/19dhyf4,Xreal,n/a_submissions
69,Responsible-You2565,,"Teacher gave us her Kik and discord for class project. Her photos on my profile. Dm her act like her student and “accidentally” send her dirty stuff, captions, tribs, edits, memes of her. Act like you thought it was your friend tell her inappropriate jokes. Her Kik: throway721221 and disc:lisaa78.",,t5_an2unz,1705991001.0,1,https://www.reddit.com/r/jerkbuds_nolim019/comments/19dhyf1/teacher_gave_us_her_kik_and_discord_for_class/,jerkbuds_nolim019,n/a_submissions
70,321ECRAB123,,Do performance problems persist?,,t5_122hf1,1705991001.0,1,https://www.reddit.com/r/Eldenring/comments/19dhyew/do_performance_problems_persist/,Eldenring,n/a_submissions
71,florausa2000,,how to send flowers from Saudi Arab to Philippines?,,t5_2roj4,1705991000.0,1,https://www.reddit.com/r/saudiarabia/comments/19dhyep/how_to_send_flowers_from_saudi_arab_to_philippines/,saudiarabia,n/a_submissions
72,AutoNewspaperAdmin,,"[World] - Famous China actress, known for big, bubbly personality, slashes weight in half for new movie, reignites body-image debate | South China Morning Post",,t5_3h9d4,1705991000.0,1,https://www.scmp.com/news/people-culture/china-personalities/article/3248245/famous-china-actress-known-big-bubbly-personality-slashes-weight-half-new-movie-reignites-body-image?utm_source=rss_feed,AutoNewspaper,n/a_submissions
73,sylvyrfyre,,"The timeslip story from Waurika, Oklahoma",,t5_3cz7c,1705991000.0,1,https://www.youtube.com/watch?v=-HWI2FRPCYw&amp;ab_channel=WeirdWorld,timeslip,n/a_submissions
74,No-Dealer-8194,,Got mega link telegram @Qexxhot10,,t5_an2unz,1705991000.0,1,https://www.reddit.com/r/jerkbuds_nolim019/comments/19dhyei/got_mega_link_telegram_qexxhot10/,jerkbuds_nolim019,n/a_submissions
75,Ernesto-it,,📌 Luca ha richiesto preventivi per installatori casa infissi e serramenti porte blindate a Cernusco sul Naviglio Milano MI,,t5_7hg7uv,1705991000.0,1,https://www.ernesto.it/posts/public/cG9zdC0xZDE3OGI0Ny1mNzI4LTRiODYtYjNlNy0wMjdkMWRkM2ZiZDM=/Luca-ha-richiesto-preventivi-per-installatori-casa-infissi-e-serramenti-porte-blindate-a-Cernusco-sul-Naviglio-Milano-MI?utm_source=reddit,Ernesto_it,n/a_submissions
76,ASGfan,Scoop Brady Talkin',Richie meets Marcia,,t5_6u5e83,1705990999.0,1,https://v.redd.it/k7soo0x883ec1,BradyBunchTVShow,n/a_submissions
77,8bit1111,,Advice on skincare routine,,t5_2vfzu,1705990999.0,1,https://www.reddit.com/r/TheGirlSurvivalGuide/comments/19dhye7/advice_on_skincare_routine/,TheGirlSurvivalGuide,n/a_submissions
78,TinyAnswer6568,,Which horror movie ACTRESS would you like to see on DWTS?,,t5_2tu45,1705990999.0,1,https://www.reddit.com/r/dancingwiththestars/comments/19dhye6/which_horror_movie_actress_would_you_like_to_see/,dancingwiththestars,n/a_submissions
79,Sweet_Philosopher178,,Brothers,,t5_2w6wd,1705990998.0,1,https://www.reddit.com/r/MuslimLounge/comments/19dhye2/brothers/,MuslimLounge,n/a_submissions
80,JayZFeelsBad4Me,,Reminder: ARIBA is dogshit garbage,,t5_2rolp,1705990998.0,1,https://www.reddit.com/r/procurement/comments/19dhye0/reminder_ariba_is_dogshit_garbage/,procurement,n/a_submissions
81,GDutch_R,,DEBUGX ON NEXUS,,t5_3a7t1,1705990998.0,1,https://www.reddit.com/r/Astroneer/comments/19dhydw/debugx_on_nexus/,Astroneer,n/a_submissions
82,cunningdick,,What's sikhi's opinion on nationalism and concept of countries?,,t5_2rfo4,1705990997.0,1,https://www.reddit.com/r/Sikh/comments/19dhydu/whats_sikhis_opinion_on_nationalism_and_concept/,Sikh,n/a_submissions
83,fifadick,,Took a sick leave today only to avoid calls and work in peace ✌️,,t5_2qib3,1705990997.0,1,https://www.reddit.com/r/sales/comments/19dhydn/took_a_sick_leave_today_only_to_avoid_calls_and/,sales,n/a_submissions
84,AlienDevs,,Deltrin City: Overdose (Playable Package),,t5_an2cxg,1705990997.0,1,https://www.reddit.com/r/DeltrinCity/comments/19dhydm/deltrin_city_overdose_playable_package/,DeltrinCity,n/a_submissions
85,Swimming-Bag9838,,2022 Apollo City Pro In the Rain?,,t5_39e4mw,1705990997.0,1,https://www.reddit.com/r/ApolloScooters/comments/19dhydl/2022_apollo_city_pro_in_the_rain/,ApolloScooters,n/a_submissions
86,qwenmn,,"BUS SHATTERED AFTER CRASH WITH LORRY @ KRANJI, PASSENGER INJURED FROM GLASS SHARDS In a recent incident on Kranji Road, a ...",,t5_4xeuoj,1705990996.0,1,https://singaporeuncensored.com/bus-shattered-after-crash-with-lorry-kranji-passenger-injured-from-glass-shards/?feed_id=141426,sporeuncensored,n/a_submissions
87,Overall_Cupcake_4406,,"My little Oliver, 3 feet long",,t5_3anbm,1705990996.0,1,https://www.reddit.com/gallery/19dhydf,DrawMyPet,n/a_submissions
88,bigstomper3,,SOR 🍍🕊️ ( 200/ DYCKMAN),,t5_8d4kmi,1705990995.0,1,https://www.reddit.com/gallery/19dhyda,Bronxghanistan,n/a_submissions
89,ageowns,,"Is cinema, as an art form, on the way out?",,t5_an3bst,1705990995.0,1,https://www.reddit.com/r/thecommentlounge/comments/19dhyd7/is_cinema_as_an_art_form_on_the_way_out/,thecommentlounge,n/a_submissions
90,roadhousefg,,Feeding Horny TNs. 1 Dick Pic To Be Fed. 05c01519425e694e65d5a0ac14ac2c21665903a226dc1877643683c3c2abd0d026,,t5_an2unz,1705990995.0,1,https://www.reddit.com/r/jerkbuds_nolim019/comments/19dhyd5/feeding_horny_tns_1_dick_pic_to_be_fed/,jerkbuds_nolim019,n/a_submissions
91,IssaClash,,[searching] th16 | very active | #UV0QUCY9,,t5_30jzq,1705990994.0,1,https://www.reddit.com/r/ClashOfClansRecruit/comments/19dhyd3/searching_th16_very_active_uv0qucy9/,ClashOfClansRecruit,n/a_submissions
92,KilroyWagner69,,Breakfast,,t5_10csy0,1705990994.0,1,https://i.redd.it/kht81p04v4ec1.jpeg,Fumofumo,n/a_submissions
93,Fluid-Somewhere2950,,the real iceberg...,,t5_22t05b,1705990994.0,2,https://i.redd.it/3awov7o2v4ec1.png,sennyk4,n/a_submissions
94,singlemom_js,,6 vials Menopur &amp; Gonal F 300 trade - looking for Lupron 2 week kit (Leuprolide acetate),,t5_2tkij,1705990994.0,1,https://www.reddit.com/r/IVF/comments/19dhycu/6_vials_menopur_gonal_f_300_trade_looking_for/,IVF,n/a_submissions
95,eigo-bunpou,,「英単語解説」nutrition-informationの意味について,,t5_7grdar,1705990993.0,1,https://www.reddit.com/r/omoshiroi_eigo_bunpou/comments/19dhycr/英単語解説nutritioninformationの意味について/,omoshiroi_eigo_bunpou,n/a_submissions
96,rilakkumakat,,Gaming Youtube Channel,,t5_2uevm,1705990993.0,1,https://www.reddit.com/r/SmallYoutubers/comments/19dhycp/gaming_youtube_channel/,SmallYoutubers,n/a_submissions
97,IrishHorse95,,Gameplay worse than ever since the last update?,,t5_55y9xp,1705990993.0,1,https://www.reddit.com/r/EAFC/comments/19dhycm/gameplay_worse_than_ever_since_the_last_update/,EAFC,n/a_submissions
98,helaryoous,,I Love My Girlfriend Shirts - Shirt Slingers Graphic Tees,,t5_3pgh1,1705990993.0,1,https://shirtslingers.com/i-love-my-girlfriend-shirts/,TargetedShirts,n/a_submissions
99,KingNigelXLII,,JaVale lights the beam in a way only he can,,t5_2rqrs,1705990993.0,1,https://streamable.com/xyozxe,kings,n/a_submissions
